Navn,Beskrivelse,Linjer,Indvidet,Type,Elevator
Nordhavn,"Nordhavn station er M4-linjens første stop efter Østerport og det første metrostop i den nye bydel Nordhavn. Herfra kører toget videre til linjens endestation Orientkaj.Metrostationen er placeret ud mod det centrale bykvarter Århusgade ved Kalkbrænderihavnsgade. I Århusgadekvarteret finder man et bredt udvalg af spændende aktiviteter og kulturelle oplevelser til alle tider af året - fra badning i Nordhavns havnepromenade Sandkaj og friluftsaktiviteter i 24 meters højde på Konditaget Lüders til filmoplevelser i bydelens bæredygtige biograf.Skift til S-togNordhavn har en varm og dyb rød farve, der signalerer trafik, transport og transit. Den røde farve går igen på de metrostationer, hvor der er mulighed for at skifte til S-tog. Det gælder Nordhavn, Østerport, Nørrebro og København H. Den dybe røde farve er derfor en hilsen til S-togene og DSB.",M4 og S-tog,I slutningen af marts 2020,Underjordisk,To
Orientkaj,"Orientkaj station er det sidste stop på M4-linjen og dermed også metroens endestation i den nye bydel Nordhavn. Orientkaj er en højbanestation placeret lige ud til Orientkajs havnebassin.Metrostationen får et lokalt arkitektonisk præg. Bydelen og bygningerne ved stationen er planlagt som Den Hvide By, og derfor er stationen udført med hvide mosaikker på trapper og elevator, mens selve stationsrummet fremstår hvidt indvendigt og med en udvendig beklædning i lyst aluminium, der spejler himlen. Højbanen i Nordhavn vil senere kunne forlænges til f.eks. Ydre Nordhavn. Læs om mulige scenarier. ",M4,I slutningen af marts 2020,Højbane,To
Havneholmen,"Havneholmen er en af de fem kommende metrostationer i Sydhavn og åbner i 2024. Metrostationen vil ligge på det tidligere parkeringsområde bag Fisketorvet.  Det forventes, at Fisketorvets kommende udbyning vil danne et tag over udgangen til metrostationen, så stationen vil ligge under en bygning ligesom metrostationen Frederiksberg Allé.",M3,i slutningen af september 2019,Underjordisk,To
Enghave Brygge,"Enghave Brygge er en af de fem kommende metrostationer i Sydhavn, som åbner i 2024. Det er også herfra, at tunnelboremaskinerne vil bore fra 2020.Stationen vil ligge i et område, som er under stor udvikling disse år med mange nye boliger på vej. ",,,,
Sluseholmen,"Sluseholmen er en af de fem kommende metrostationer i Sydhavn, som åbner i 2024. Stationen vil ligge for enden af Fordgraven i et område, som er under stor udvikling disse år med mange nye boliger og erhvervsbygninger på vej. ",,,,
Ny Ellebjerg,"Ny Ellebjerg er en af de fem kommende metrostationer i Sydhavn, som åbner i 2024. Stationen vil ligge tæt på S-togs- og regionaltogslinjerne og udgøre et af de største trafikale knudepunkter i hovedstaden i fremtiden. ",,,,
Mozarts Plads,"Mozarts Plads er en af de fem kommende metrostationer i Sydhavn, som åbner i 2024. Stationen vil ligge i udkanten af pladsen, så der atter er plads til ophold i området omkring stationen. ",,,,
