Navn,Beskrivelse,Linjer,Indvidet,Type,Elevator
Vanløse,"Side om side med S-togstationen ligger Vanløse Station, som er den vestligst beliggende station på metrolinjerne M1 og M2. Midt i Vanløses rolige forstadsmiljø fungerer Vanløse Station også som en travl omstigningsstation mellem metro og S-tog og skaber med sine hyppige afgange hurtige forbindelser til det centrale København. Stiger du af i Vanløse, kan du blandt andet tage en slentretur på Vanløse Torv, se teater eller høre koncert på Vanløse Kulturstation, eller shoppe i Vanløses indkøbscenter Kronen, som du let kommer til via den direkte adgang i den østlige ende af metroperronen.",M1 og M2 samt S-tog,Oktober 2003,Overjordisk,En
Flintholm,"Flintholm er et af Danmarks største kollektive trafikknudepunkter, hvor tusindvis af passagerer hver dag skifter mellem Metro, tog, S-tog og bus på vej ind og ud af hovedstaden. Området præges af overgangen fra forstad til by, hvor villakvarterer bliver til boligkarreer i storbystil. Lige ved siden af stationen ligger Grøndalsparken som en lang, grøn åre, der strækker sig fra Nørrebro til Vanløse.",M1 og M2 samt S-tog,Oktober 2003,Overjordisk,To
Lindevang,"Vidste du, at Lindevang Station faktisk er en tidligere S-togstation fra 1985? I dag er Lindevang Station trukket i metrotøjet og fungerer dagligt som station for mange af de studerende på Copenhagen Business School. Kvarteret omkring Lindevang Station består hovedsagligt af større ejendomskomplekser i selskab med Lindevangsparken, der ligger som en lille, grøn oase på det ydre Frederiksberg.",M1 og M2,Oktober 2003,Overjordisk,En
Fasanvej,"På Nordre Fasanvej finder du Fasanvej Station, som hver dag transporterer studerende på Copenhagen Business School til og fra studie. Fasanvej Station placerer sig midt i overgangen fra ydre til indre Frederiksberg, et kvarter som i høj grad præges af beboelse, men som også huser Frederiksberg Hospital og har Frederiksberg Have inden for gåafstand.",M1 og M2,Oktober 2003,Underjordisk,En
Frederiksberg,"Dør om dør med Frederiksberg Centeret ligger Frederiksberg Station, hvorfra Falkoner Allé snor sig forbi med hyggelige fortovscafeer og spillestedet Falkoner Salen, der afholder koncerter og teaterforestillinger. Tæt på stationen finder du også en anden ikonisk Frederiksberg-vej, Gammel Kongevej, som byder på et hav af lækre butikker med alt fra kvalitetschokolade til tøj og sko, og for enden af Gammel Kongevej ligger Frederiksberg Rådhus. Derudover finder du en af hovedstadens største haver, Frederiksberg Have, en lille gåtur fra stationen.",M1 og M2 og M3,Maj 2003,Underjordisk,To
Forum,"Forum Station er opkaldt efter den store oplevelseshal Forum, som ligger lige ved siden af metrostationen. Metrostationen har hjemme dér, hvor Frederiksberg møder Nørrebro. Der er et stenkast til Søerne, og du kan hurtigt komme til Blågårdsgades hyggelige caféliv og små butikker. Forum var tidligere den festlige kulisse om det københavnske seksdagesløb i cykling og har siden været benyttet til koncerter, messer og meget andet. Over for Metrostationen finder du det fredede Radiohuset, der tidligere tilhørte DR, men som nu danner ramme om Det Kongelige Danske Musikkonservatorium. Ikke langt fra stationen ligger flere uddannelsesinstitutioner som Københavns Tekniske Skole, handelsskolen Niels Brock og Frederiksberg Campus også kaldet Landbohøjskolen, hvis store universitetshave uden tvivl er et besøg værd.",M1 og M2,Maj 2003,Underjordisk,En
Nørreport,"Nørreport er Danmarks travleste station. Her kan byens mange passagerer skifte mellem metro, tog og bus. Stationens store paddehatte skyder op i hjertet af Indre By mellem grønne åndehuller som Botanisk Have, Ørstedsparken og Kongens Have eller store seværdigheder som kronjuvelerne på Rosenborg Slot eller Thyco Brahes gamle observatorium Rundetaarn. Kun 100 meter fra Nørreport Station finder du Israels Plads og det lækre madmarked TorvehallerneKBH, som rummer mere end 60 forskellige stader. Her kan du spise din frokost, shoppe delikatesser eller tage en hurtig kop kaffe med videre.",M1 og M2 samt S-tog og regionaltog,Maj 2003,Underjordisk,To
Kongens Nytorv,"Kongens Nytorv ligger i Københavns centrum. Pladsen er fra 1670 og er omgivet af fornemme bygninger og palæer som Det Kongelige Teaters Gamle Scene og et af Danmarks fineste hoteller, Hotel D’Angleterre. Fra stationen kan du tage rulletrapper direkte ind i stormagasinet Magasin, hvorfra der også er adgang til gågaden Strøget, hvor shoppelysten kan få frit spil. Klods op ad Kongens Nytorv ligger den gamle havnekanal Nyhavn, som sitrer af sommerstemning i juli og august, mens duften af gløgg og brændte mandler hænger i luften i december. For enden af Nyhavn finder du også Skuespilhuset, der er en del af Det Kongelige Teater, og den nye bro, Inderhavnsbroen, som forbinder Nyhavn med Christianshavn.",M1 og M2 og M3,Maj 2003,Underjordisk,To
Christianshavn,"For godt 400 år siden anlagde Christian d. 4. en ny bydel. Bydelen skulle hedde Christianshavn, ligge mellem Indre By og Amager og omgives af vand. Det gør sig stadigvæk gældende den dag i dag, hvor bydelens kanaler danner rammen for både husbåde, turistbåde og hyggelige caféer. På Christianshavn finder du også en af Københavns største turistattraktioner, nemlig Fristaden Christiania, hvis skæve og kreative ånd udtrykkes i områdets selvbyggede huse og små kunstværksteder. Tæt på Christianshavn Station ligger også to af Københavns historiske kirker, Christianskirken og Vor Frelsers Kirke, og hvis du vil se Christianshavn fra oven, kan du besøge Vor Frelser Kirkes gyldne kirketårn, hvis sidste 150 trin løber på ydersiden af selve tårnet.",M1 og M2,Oktober 2003,Underjordisk,To
Amagerbro,"Metroen kører direkte til hjertet af Amagerbro. Lige ved siden af stationen ligger Amager Centret Amager, der sammen med Amagerbrogades væld af butikker udgør et stjernegodt indkøbskvarter. På den nærliggende Holmbladsgade fordeler lejligheder, små butikker og hyggelige caféer sig langs gaden, hvor du også finder idræts- og kulturhuset Prismen, der afholder alt fra teateropvisning og kunstudstilling til portvinsfestival og Amagerbros helt eget loppemarked.",M1 og M2,Oktober 2003,Underjordisk,En
Lergravsparken,"Indtil 2007 var Lergravsparken endestation for metrolinjen M1. I efteråret 2007 åbnede den sidste del af strækningen fra Lergravsparken til Københavns Lufthavn. Området omkring Lergravsparken Station udgøres af et stort beboelseskvarter, der har givet stationen sit navn. Lergravsparken Station er placeret i et hjørne af et grønt parkanlæg med gode græsplæner og en bemandet legeplads.",M1 og M2,Oktober 2003,Underjordisk,En
Øresund,"Blot fem kilometer fra Indre By udfolder hovedstadens største strand sig med hele 4,6 kilometer sand og vand. Fra Øresund Station er der kun få hundrede meter til den stort anlagte Amager Strandpark, hvor du fra vandkanten kan se helt til Sverige. Den genopførte Helgoland Badeanstalt er især populær i sommermånederne, men bruges også flittigt af de københavnske vinterbadere.",M1 og M2,September 2007,Overjordisk,En
Amager Strand,"Hvis du stiger af på Amager Strandpark station, træder du ud i et Amagers gamle villakvarterer med haver og hække. Her er der ikke langt til vandet, sandet og de mange forskellige oplevelser, du kan finde i Amager Strandpark. Den asfalterede sti er god til løb og rulleskøjter, og ved strandstation 3 finder du en dykkerbane. I lagunen er vandet lavt og særligt velegnet til små børn, og længere ude i lagunen ses ofte mere seriøse svømmere iført våddragter. På det grønne græsområde langs med Amager Strandvej er der lagt op til picnic og grillaftener, og har du lyst til at spille beachvolleyball, er der også mulighed for det.",M1 og M2,September 2007,Overjordisk,En
Femøren,"Stationen er opkaldt efter et af de to grønne naturområder Femøren og Tiøren, som bruges til sommerkoncerter, eller hvis cirkus er i byen. På de vindblæste dage er Femøren Station en et hit blandt surfere, for Amager Strandpark ligger kun nogle få hundrede meter fra Amager Strandpark, hvor der omkring strandstation 4 og 5 er etableret en surferzone til blandt andet kitesurfing og blokarts. Tæt på stationen finder du Kastrup Fort, resterne af et gammelt forsvarsbatteri, der i dag huser en restaurant og en legeplads.",M1 og M2,September 2007,Overjordisk,En
Kastrup – Den Blå Planet,"Danmarks Akvarium, Den Blå Planet, åbnede i 2013 med en fantastisk placering lige ud til Øresund og lige så fantastisk arkitektur. Der er omkring 600 meter at gå fra Kastrup Metrostation til akvariet, og hvis du følger de blå bølgebænke, bliver du ført direkte ind i det store akvarie, som huser tusindvis af dyr fra hele verden, som boltrer sig i akvariets syv millioner liter azurblåt saltvand. Udover søpapegøjer og hammerhajer ligger Kastrup Station også i nærheden Kunstmuseet Kastrupgårdsamlingen, et gammelt landsted nu indrettet som museum med moderne grafik og samtidskunst.",M1 og M2,September 2007,Overjordisk,En
Københavns Lufthavn,"Metroen tager dig de første skridt, når du skal ud i verden. Stationen er nemlig en del af Københavns Lufthavns Terminal 3, som huser ankomsthallen og check-in-området. Vil du undgå lange køer og få en flyvende start på din rejse, kan du i ro og mag klare dit check-in på metrostationen, hvor du også finder check-in-automater til selvbetjening. Derefter skal du bare aflevere din bagage ved bagageindleveringen eller gå direkte fra metroen til sikkerhedskontrollen, hvis du kun har håndbagage. Er du lige ankommet til Københavns Lufthavn, tager det kun 14 minutter med Metroen at komme til Københavns centrum.",M1 og M2,September 2007,Overjordisk,To
Islands Brygge,"Mellem den sommerpopulære havnepromenade Islands Brygge, Københavns Universitet Amager, DR Byen og det nordligste stykke af Amager Fælled ligger Islands Brygge Station. Studerende på Københavns Universitet bruger stationen hele året for at komme til og fra studie, og i sommermånederne bruges stationen især, når badelysten og sulten for is melder sig københavnerne. Tæt på stationen ligger også kollegierne det kubiske Bikuben og det cirkelrunde Tietgenskollegium, som begge er eksempler på den innovative, eksperimenterende arkitektur, der er blevet en del af det københavnske bybillede.",M1 og M2,Oktober 2002,Underjordisk,En
DR Byen,"Det store naturområde Amager Fælled løber langs metroskinnerne og sender frisk luft ind over DR Byen. DR har adresse på Emil Holms Kanal, og DR Byen har her fået sit helt eget postnummer: 0999 København C. Fra DR Byen Station er der adgang til DRs koncertsal, og ikke langt derfra ligger IT-Universitet. Området er på en og samme tid urbant, moderne og meget grønt. Der er vitterligt tale om en by i byen.",M1 og M2,Oktober 2002,Overjordisk,En
Sundby,"Sundby Metrostation grænser op til Amager Fælled, der med sin friske luft og store naturarealer indbyder til løb og gåture. På stationens modsatte side ligger rækkehuse af både ny og ældre dato samme med nogle af Amagers haveforeninger. Metrostationen er oplagt at bruge, hvis du ønsker at slippe væk fra byen et kort øjeblik.",M1 og M2,Oktober 2002,Overjordisk,En
Bella Center,"Lige ved siden af stationen ligger, det store konferencecenter Bella, hvor der afholdes alt lige fra topmøder til messer og kræmmermarkeder. I samme konferencekompleks finder du hotellet Bella Sky, der med sine to hældende tårne og sort-hvidmønstrede facader er et eksempel på den nye eksperimenterende arkitektur, som findes i Ørestad. Ikke langt fra Bella Sky ligger boligbyggeriet VM Bjerget, som kort efter sin færdiggørelse i 2008 modtog prisen som verdens bedste boligbyggeri på World Architecture Fair i Barcelona.",M1 og M2,Oktober 2002,Overjordisk,En
Ørestad,"Man kan ikke sige Ørestad uden også at sige Field’s. Der er tale om Skandinaviens største shoppingcenter med et utal af butikker. Ørestad er en ny bydel, der præges af moderne, innovativ arkitektur til både beboelse og erhverv. Blandt byggerierne findes Crowne Plaza Copenhagen Towers, som er den første CO2-neutrale hotelbygning i Danmark. Ikke langt fra stationen finder du også Københavns nye multifunktionelle arena, Royal Arena, som siden åbningen i 2017 allerede har lagt scene til mange af verdens største kunstnere, og dannet rammen om store sportsbegivenheder som verdensmesterskaberne i håndbold og ishockey.",M1 og M2 samt S-tog,Oktober 2002,Overjordisk,En
Vestamager,"På yderstationen Vestamager Station møder linjen det 2000 hektar store fredede naturområde Kalvebod Fælled. Intet andet sted i Europa finder du et naturområde af denne størrelse så tæt på en storby. Tæt på stationen skyder Ørestads nybyggede lejlighedskomplekser op langs med metroskinnerne sammen med den moderne og anmelderroste beboelsesbygning 8-tallet. Den store bygning ligger som et bjerg i landskabet, inden de store, flade græsarealer overtager scenen. Tæt på stationen finder du også Naturcenter Amager, hvor du kan blive klogere på dyr og natur eller leje cykler, hvis du ønsker at opleve Kalvebod Fælled på to hjul.",M1 og M2,Oktober 2002,Overjordisk,En
Marmorkirken,"Metrostationen Marmorkirken ligger ikke blot ved siden af den smukke gamle kirke – den placerer sig også i midten af et Københavns ældste kvarterer, hvor store københavnske seværdigheder som Amalienborg Slotsplads, Langelinie og Kongens Have ligger inden for få minutters gang. Derudover byder området også på en række museer, deriblandt Designmuseum Danmark, Davids Samling, Amalienborgmuseet og Medicinsk Museion. Under jorden er væggene på Marmorkirkens metrostation beklædt med sandfarvede kalkstenspaneler i en varm og gylden farve, som er inspireret af de palæer, der ligger over jorden. Sandstenen er kendetegnet ved at indeholde små fossiler, der er millioner af år gamle – og det kan både være forstenede søpindsvin eller blæksprutter. Særligt for metrostationen under Marmorkirken er stationens dybde. Når du står på stationens nederste perron, befinder du dig 30 meter under jordens overflade.",M3 og M4,i slutningen af september 2019,Underjordisk,To
Gammel Strand,"Skråt over for metrostationen på Gammel Strand ligger Christiansborg, hvor det danske Folketing til dagligt begår sig. Gammel Strand er en gammel havnepromenade, hvor velbesøgte restauranter, cocktailbarer og caféer ligger side om side. Området omkring Gammel Strand bærer også præg af Københavns hovedpulsåre Strøget, der også løber forbi den nærliggende Højbro Plads. Mellem Christiansborg og Gammel Strand finder du det store græsk-mytologiske Thorvaldsens Museum. Under jorden er stationens vægge beklædt med hvide keramiske plader, som, når de udsættes for kunstlys, afføder et levende lysspil. Lysspillet er en hilsen til sollyset i vandoverfladen i Gammel Strands kanal, der løber lige ved siden af stationen.",M3 og M4,i slutningen af september 2019,Underjordisk,To
Rådhuspladsen,"Tag Metroen direkte til en af Københavns største og mest prominente pladser. Stationen befinder sig naturligvis lige ved siden af Københavns Rådhus, som også er dér, hvor Københavns hovedpulsåre, Strøget, begynder med butikker så langt øjet rækker. Rådhuspladsen er også samlingsstedet, når de store danske sportspræstationer skal hædres, og når danskerne samles for at skyde nytåret ind ved midnat.Rådhuspladsen har mange forskellige udtryk afhængigt af tidspunktet på dagen. Om morgenen er der stille og roligt, i løbet af eftermiddagen besøges pladsen især af turister, og om aftenen tiltrækker pladsen unge mennesker fra Københavns byliv. Under jorden er væggene beklædt med funklende mørkt glas, som skal reflektere byens farverige liv, neonlys i natten, billygter i den våde asfalt og lysaviser på tagene. Det er om aftenen, at Rådhuspladsen kommer til sin fulde ret.",M3 og M4,29. september 2019,Underjordisk,To
København H,"Metrostationen ligger lige op ad Københavns Hovedbanegårds smukke gamle terminalsbygning, hvor IC-, Regional og Øresundstog blander sig med S-tog. En gangtunnel er etableret og forbinder den eksisterende station med metrostationen, hvilket gør det nemt at skifte mellem metro og de øvrige togperroner. Under jorden er metrostationens vægge beklædt med røde keramiske paneler ligesom væggene på Nørrebro og Østerport. Farven er en hilsen til S-togene, som du kan skifte til på disse stationer. Fra metrostationen tager det kun få minutters gang at nå til store attraktioner som forlystelsesparken Tivoli, Ny Carlsberg Glyptotek eller Rådhuspladsen, hvorfra du også kan slentre videre ad Strøget. Tæt på stationen finder du også en af Vesterbros hovedpulsårer, Istedgade, der giver liv til et pulserende natteliv fyldt med barer og restauranter. I samme område finder du også det populære madmekka, Kødbyen, hvor gamle industrihaller i dag bruges som hippe restauranter og danseglade natklubber.",M3/M4 samt S-tog og regionaltog.,29. september 2019,Underjordisk station,To
Enghave Plads,"For enden af Istedgade ligger Enghave Plads som en smørklat mellem cafeer, barer, restauranter og specialbutikker. Lige ved siden af metrostationen ligger det grønne åndehul med bemandet legeplads, Enghave Park, og kun få minutters gang fra spillestedet VEGA eller det nybyggede Carlsberg Byen. Begiver du dig under jorden, vil du blive mødt af stationsrummets røde, håndlavede teglsten, der hænger som en hilsen til de mange gamle murstensbygninger, som befinder sig i området omkring Enghave Plads.",M3,i slutningen af september 2019,Underjordisk station,To
Frederiksberg Allé,"Fra Frederiksberg Have til Vesterbrogade strækker den lange allé af store lindetræer sig. Mellem træerne finder du hyggelige cafeer og kvalitetsbutikker som Frederiksberg Chokolade eller det nybyggede madhus og boligkompleks, som placerer sig lige over selve metrostationen.En spytklat fra stationen finder du også Betty Nansen Teateret, og inden for få minutters gang kan du nå til gader som Gammel Kongevej eller Værnedamsvej eller besøge Storm P. Museet eller museet for Humor og Satire, Alhambra. Frederiksberg Allés grønne islæt er også trukket med ned, hvor den grønne farve pryder stationsrummets vægge.",M3,i slutningen af september 2019,Underjordisk,To
Aksel Møllers Have,"Tager du Metroen til Aksel Møllers Have tager rulletrapperne dig hele vejen til det frederiksbergske café- og butiksliv, der udspiller sig på Godthåbsvej, som løber forbi stationen. Aksel Møllers Have er en af Frederiksbergs grønne byoaser, og stationen ligger få minutters gang fra både Frederiksberg Svømmehal, Frederiksberg Hospital og Frederiksberg Campus også kaldet Landbohøjskolen, hvis smukke universitetshave danner perfekte rammer for en god gåtur i det grønne. I stationsrummet under Aksel Møllers Have er væggene beklædt med teglsten i brunlige caffe latte-farver, der er inspireret af bygningen Metronomen, et kulturhus, der i dag lægger hus til koncerter og øvrige kulturarrangementer.",M3,i slutningen af september 2019,Underjordisk station,To
Nuuks Plads,"Metrostationen ligger på Jagtvej nær Rantzausgade. Over stationen finder du det gamle Landsarkiv, som stationsrummets vægbeklædning også er inspireret af, hvorfor væggene prydes af teglsten i sort, grå og brun skiffer. En kort gåtur fra stationen ligger Nørrebroparken, hvor der er en stor legeplads, fodboldbaner og Stefansgade pulserende cafémiljø løbende langs parken. I den nærliggende Jægersborggade ligger hyggelige små specialbutikker og luksusrestauranter side om side. Få minutters gang fra stationen finder du også grønne åndehuller som Assistens Kirkegård og Hans Tavsens park.",M3,i slutningen af september 2019,Underjordisk,To
Nørrebros Runddel,"Metrostationen ligger lige ved Nørrebrogade og i det ene hjørne af Assistens Kirkepård. Her kan du enten begive dig ud i Nørrebros gader, eller du kan slentre en tur på den historiske kirkegård. Under jorden har vægbeklædningen gullige teglsten ladet sig inspirere af områdets teglstensbygninger og de mange monumenter på Assistens Kirkegård. Metrostationen har som den eneste station ét stort ovenlys i stedet for flere små som tilfældet på andre stationer. Når solen står rigtigt, vil lyset derfor vælte ned over dig, når du befinder dig i stationsrummet på Nørrebros Runddel.",M3,i slutningen af september 2019,Underjordisk,To
Nørrebro,"På grænsen mellem Nørrebro og Nordvest finder du Nørrebro Station, som indtil 2019 har fungeret som S-togstation, men som nu har fået selskab af en underjordisk metrostation. Stationen ligger lige i nærheden af Den Røde Plads, hvor Nørrebros lokale står på skateboard, spiller musik, afholder loppemarkeder og meget mere. På tre af Cityringens stationer bliver stationsrummenes vægge beklædt med røde keramiske plader, hvoraf Nørrebro er den ene. Den røde farve er en hilsen til S-togene, som derfor også kan findes på metrostationerne København H og Østerport, hvor der ligeledes kan skiftes mellem metro og S-tog.",M3,i slutningen af september 2019,Underjordisk,To
Skjolds Plads,"Metrostationen ligger nær Tagensvej tæt på den kommende Niels Bohr bygning samt det nuværende Nørre Campus, der er en del af Copenhagen Science City, som rummer Københavns Universitets Sundheds- og Natur og Biovidenskabelige Fakulteter. Få minutters gang fra stationen finder du det aktive kulturhus Osramhuset, mens du også kan komme hurtigt hen til den hyggelige Balders Plads, hvor der ofte afholdes loppemarkeder og jazz-koncerter. I stationsrummet under Skjolds Plads består vægbeklædningen af vinklede paneler af strukturglas med en sølvfarvet bagside, som reflekterer lyset og fylder rummet med et sølvfarvet skær. Legen med lyset er en hilsen til områdets naturvidenskabelige miljø, hvor lys og naturvidenskab til daglig går hånd i hånd.",M3,i slutningen af september 2019,Underjordisk,To
Vibenshus Runddel,"Lige ved krydset mellem Jagtvej og Nørre Allé ligger Vibenshus Runddels metrostation. Stationen er nabo til en af Københavns største parker, Fælledparken, der med sine store, grønne områder danner rammen for et idrætsengageret, farverigt lokalmiljø. Mange løbeglade københavnere jogger rundt i Fælledparken, som også huser flere fodboldbaner og et udendørs træningsanlæg samt det store fodboldstadion, Telia Parken, hvor F.C. Københavns ’løver’ har hjemmebane. Den farverige sammensætning af Østerbros lokalmiljø er også taget med ned under jorden, hvor stationsrummets vægbeklædning prydes af lister i alverdens farver.",M3,i slutningen af september 2019,Underjordisk,To
Poul Henningsens Plads,"Stationen ved Poul Henningsens Plads ligger midt på Østerbro og er placeret midt mellem store, lokale omdrejningspunkter som Svanemøllehallen, Østre Gasværk Teater, Idrætshuset og Østerbro Stadion. Når du træder ned i stationsrummet på Poul Henningsens Plads, mødes du af et markant vægmønster, hvor keramiske plader i to nuancer af grå møder hinanden i skiftevis lodrette og vandrette flader. Vægmønstret er stærkt inspireret af metrostationens berømte nabobygning Øbrohus, som er kendt for sit særlige facademønster.",M3,29. september 2019,Underjordisk,To
Trianglen,"Over jorden løber trafikken langs Østerbrogade og Blegdamsvej, mens metroen stopper 20 meter under jorden. Når du træder ud i stationsrummet, bliver du reflekteret af stationens vægbeklædning, som består af glasplader med små striber af spejlrefleks. På den måde varierer stationens udsmykning alt efter, hvem der er i rummet. På dage, hvor F.C. København spiller kampe i den nærliggende Telia Parken, vil rummet være hvidt og blåt, og 1. maj vil rummet farves rødt af svajende faner, når Arbejdernes Internationale Kampdag afholdes i Fælledparken. På travle tidspunkter vil tusindvis af forskellige tøjfarver spejle sig i glasset, og på rolige dage vil væggene fremstå enkle og elegante. Stationen skal vise Østerbrokvarterets skiftende puls.",M3,i slutningen af september 2019,Underjordisk,To
Østerport,"Metrostationen ligger på Oslo Plads, som placerer sig uhyre tæt på Østre Anlægs nordlige ende. Stationen befinder sig inden for få minutters gang til smukke københavnske steder som det gamle fæstningsanlæg Kastellet eller de gule militærboligkvarter Nyboder. Tager du metroen til Østerport, bliver du – ligesom på Nørrebro og København H – mødt af røde keramiske paneler, der viser, at du kan skifte til DSB's tog og S-tog. Fra metrostationens trapper kan du hurtigt nå de øvrige transportformer på Østerport station. I starten af 2021 forventes forbindelsen via metrostationens trappe til fortovet foran Østerport Station at være klar til at lede passagerer nemmere og hurtigere til tog og S-tog. Indtil da, er der etableret en midlertidig trappe, som forbinder gangtunnelen fra metrostationen til Oslo Plads ved Østbanegade.",M3/M4 samt S-tog og regionaltog.,september 2019,Underjordisk,To
